{
  "accounting": {
    "counted_entries": [],
    "measured_at_revision": 18,
    "result_byte_cap": 26214400,
    "result_bytes": 0,
    "schema_version": "1",
    "task_byte_cap": 262144000,
    "task_bytes": 38569
  },
  "artifact_digest": "0d181e6cfcdc025b10e16469dac07665cbb85e69bce79e2684efff62dc81c95a",
  "input_fingerprint": "643a097810100c16012bc85027c2e61c80463452d323850fab7b65cb0b08dca3",
  "outputs": [],
  "phase_instance": "prd",
  "projections": [],
  "repository_identity_digest": "5861ad3efec19d13e60f4b7476aea41151d4411b8b3fdd178038bc951a4778dc",
  "result_id": "state-result-c0b22d99c0887ef2f188eb88fcc76f29",
  "schema_version": "1",
  "secret_scan": {
    "detector_set_id": "secretlint:v1:c823338405d647fa5308ef65538fca46af9c31ca460a699cd9d7e64a88db9896",
    "outcome": "clean",
    "scanned_paths": [],
    "schema_version": "1"
  },
  "snapshot_digest": "04fb2966b5c55579399c7a17c53947cc50c3500c36eedc3e5a4d402047ac1f67",
  "source_artifact": {
    "artifact_kind": "triage",
    "evidence": {
      "accepted_count": 0,
      "accepted_editorial_count": 0,
      "current_evidence_set_digest": "6b3c0b647eecf84c7c5cde0680bf4a46349727ee953214f534d4fa1730302301",
      "dispositions": [],
      "input_fingerprint": "643a097810100c16012bc85027c2e61c80463452d323850fab7b65cb0b08dca3",
      "phase_instance": "prd",
      "rejected_count": 0,
      "schema_version": "1",
      "source_evidence_digests": [
        "1425f662c6bf14a1fdae3e8c8356b32a1931d1ddc421476102ae497334dbc70b"
      ],
      "step": "triage",
      "subject_digest": "801652c7f12171429cc26bb6b599864818f4b0867225b00226f21631936b0153",
      "task_id": "api-refactor"
    },
    "schema_version": "1"
  },
  "step": "triage",
  "task_id": "api-refactor"
}
