{
  "accounting": {
    "counted_entries": [],
    "measured_at_revision": 188,
    "result_byte_cap": 26214400,
    "result_bytes": 0,
    "schema_version": "1",
    "task_byte_cap": 262144000,
    "task_bytes": 23050951
  },
  "artifact_digest": "43feba979a6060ca61a4cf827db36346eb7476dd43e2e73c59226ae8de65fe5c",
  "input_fingerprint": "93c9db2ac9ef76037eae0933532ad483c9e7d05b969ab09e135b97410eed5f67",
  "outputs": [],
  "phase_instance": "phase-design-4",
  "projections": [],
  "repository_identity_digest": "5861ad3efec19d13e60f4b7476aea41151d4411b8b3fdd178038bc951a4778dc",
  "result_id": "result-bf948915e45ab6bb7465a342d143cafa",
  "schema_version": "1",
  "secret_scan": {
    "detector_set_id": "secretlint:v1:c823338405d647fa5308ef65538fca46af9c31ca460a699cd9d7e64a88db9896",
    "outcome": "clean",
    "scanned_paths": [],
    "schema_version": "1"
  },
  "snapshot_digest": "04fb2966b5c55579399c7a17c53947cc50c3500c36eedc3e5a4d402047ac1f67",
  "source_artifact": {
    "artifact_kind": "review-evidence",
    "evidence": {
      "adapter": "claude-cli",
      "assurance": "server-attested",
      "blocking_count": 0,
      "cli_version": "2.1.238",
      "effort": "medium",
      "envelope_input_digest": "00b6cfdd644ab23ffde476ebd4810d421202f4252cbbe37692c72ef11ac0400f",
      "findings": [],
      "input_fingerprint": "93c9db2ac9ef76037eae0933532ad483c9e7d05b969ab09e135b97410eed5f67",
      "invocation_id": "invocation-7291348bd0a841016737307486b0f02a",
      "matched_rule_versions": [],
      "model": "claude-opus-5",
      "model_family": "claude",
      "observed_output_digest": "e3247e28e1b444be54aa5dfec775f1d5326735afce8f55257ff2c08528cbb554",
      "phase_instance": "phase-design-4",
      "producer_family": "codex",
      "result_id": "result-bf948915e45ab6bb7465a342d143cafa",
      "role": "counter-review",
      "rubric_digest": "8023a567948bc5beb9caa889ddb1525c3309de7e2556a88d8182098e4afbbd25",
      "schema_version": "1",
      "step": "counter_review",
      "subject_digest": "9b27810cef7ee9bb4d9c3f21fd47c15e048dafb137e4ce3454ccc1c752b7b046",
      "task_id": "review-flexibility",
      "verdict": "pass"
    },
    "schema_version": "1"
  },
  "step": "counter_review",
  "task_id": "review-flexibility"
}
