{
  "accounting": {
    "counted_entries": [],
    "measured_at_revision": 27,
    "result_byte_cap": 26214400,
    "result_bytes": 0,
    "schema_version": "1",
    "task_byte_cap": 262144000,
    "task_bytes": 59036
  },
  "artifact_digest": "c3e5ec83e3d217ef544268ce2e7eb5125f512a2dd079d0bbaa0b28c7c794c441",
  "input_fingerprint": "21230fe376905f962767c385973884ddef7d9aeed77ec2a98b23c52f8fd9ac29",
  "outputs": [],
  "phase_instance": "design",
  "projections": [],
  "repository_identity_digest": "5861ad3efec19d13e60f4b7476aea41151d4411b8b3fdd178038bc951a4778dc",
  "result_id": "state-result-8962ac8823617d4ad9cd3c5ab8fe4bb4",
  "schema_version": "1",
  "secret_scan": {
    "detector_set_id": "secretlint:v1:c823338405d647fa5308ef65538fca46af9c31ca460a699cd9d7e64a88db9896",
    "outcome": "clean",
    "scanned_paths": [],
    "schema_version": "1"
  },
  "snapshot_digest": "04fb2966b5c55579399c7a17c53947cc50c3500c36eedc3e5a4d402047ac1f67",
  "source_artifact": {
    "artifact_kind": "triage",
    "evidence": {
      "accepted_count": 0,
      "accepted_editorial_count": 0,
      "current_evidence_set_digest": "8c94200c7bbc9b679ed71d98ca1f514b1b435acb0f02fb25e6d5683271baeccd",
      "dispositions": [],
      "input_fingerprint": "21230fe376905f962767c385973884ddef7d9aeed77ec2a98b23c52f8fd9ac29",
      "phase_instance": "design",
      "rejected_count": 0,
      "schema_version": "1",
      "source_evidence_digests": [
        "e683620aaeffa67f1244d40b35dfd06e9022721b57218da75735d9e241c44612"
      ],
      "step": "triage",
      "subject_digest": "e46826fb324c29dbf63b9314c7613ab59bd39e52f1a7e7ea895da2c3c30662d3",
      "task_id": "review-flexibility"
    },
    "schema_version": "1"
  },
  "step": "triage",
  "task_id": "review-flexibility"
}
