{
  "accounting": {
    "counted_entries": [],
    "measured_at_revision": 79,
    "result_byte_cap": 26214400,
    "result_bytes": 0,
    "schema_version": "1",
    "task_byte_cap": 262144000,
    "task_bytes": 368070
  },
  "artifact_digest": "620592091e40ac4e2725e8f3fa46405f6c3d1ac92069471bf731149da2b244c2",
  "input_fingerprint": "3baa571cff52e0d4b1de357e23f61e0419a92dfec065850ba1c8722fd33f7d4e",
  "outputs": [],
  "phase_instance": "phase-design-1",
  "projections": [],
  "repository_identity_digest": "5861ad3efec19d13e60f4b7476aea41151d4411b8b3fdd178038bc951a4778dc",
  "result_id": "result-1656ec4bc569242ce33d05aef91cad14",
  "schema_version": "1",
  "secret_scan": {
    "detector_set_id": "secretlint:v1:c823338405d647fa5308ef65538fca46af9c31ca460a699cd9d7e64a88db9896",
    "outcome": "clean",
    "scanned_paths": [],
    "schema_version": "1"
  },
  "snapshot_digest": "04fb2966b5c55579399c7a17c53947cc50c3500c36eedc3e5a4d402047ac1f67",
  "source_artifact": {
    "artifact_kind": "review-evidence",
    "evidence": {
      "adapter": "claude-cli",
      "assurance": "server-attested",
      "blocking_count": 0,
      "cli_version": "2.1.233",
      "effort": "medium",
      "envelope_input_digest": "c2699a654f6be051c03d306555f89740ded667f8fb1ff26c2063dea9bb56cdb5",
      "findings": [],
      "input_fingerprint": "3baa571cff52e0d4b1de357e23f61e0419a92dfec065850ba1c8722fd33f7d4e",
      "invocation_id": "invocation-fc73caef161d6720d8e2a193bf37bb5d",
      "matched_rule_versions": [],
      "model": "claude-opus-5",
      "model_family": "claude",
      "observed_output_digest": "6aa441a2a0524cf4bc3f95c661992af6c28a7edcd036ac730f86bf77a724a28d",
      "phase_instance": "phase-design-1",
      "producer_family": "codex",
      "result_id": "result-1656ec4bc569242ce33d05aef91cad14",
      "role": "counter-review",
      "rubric_digest": "8023a567948bc5beb9caa889ddb1525c3309de7e2556a88d8182098e4afbbd25",
      "schema_version": "1",
      "step": "counter_review",
      "subject_digest": "5e218ea4ed5d6da531cf5940ff9be6c9cce30a12176660032ac5e1727347fc38",
      "task_id": "api-refactor",
      "verdict": "pass"
    },
    "schema_version": "1"
  },
  "step": "counter_review",
  "task_id": "api-refactor"
}
