{
  "accounting": {
    "counted_entries": [],
    "measured_at_revision": 111,
    "result_byte_cap": 26214400,
    "result_bytes": 0,
    "schema_version": "1",
    "task_byte_cap": 262144000,
    "task_bytes": 16512152
  },
  "artifact_digest": "8645c38eeb8e0e39c6c4763d240b4023ee83087dc9bb05c4f1ce713c3804ac65",
  "input_fingerprint": "dbb90487e38f52b4c6fe3f9107295f251c411e78f78b199482f911fa4baaeec4",
  "outputs": [],
  "phase_instance": "phase-impl-3",
  "projections": [],
  "repository_identity_digest": "5861ad3efec19d13e60f4b7476aea41151d4411b8b3fdd178038bc951a4778dc",
  "result_id": "result-142cf874e19846496079f0a3f9fbf99f",
  "schema_version": "1",
  "secret_scan": {
    "detector_set_id": "secretlint:v1:c823338405d647fa5308ef65538fca46af9c31ca460a699cd9d7e64a88db9896",
    "outcome": "clean",
    "scanned_paths": [],
    "schema_version": "1"
  },
  "snapshot_digest": "04fb2966b5c55579399c7a17c53947cc50c3500c36eedc3e5a4d402047ac1f67",
  "source_artifact": {
    "artifact_kind": "review-evidence",
    "evidence": {
      "adapter": "claude-cli",
      "assurance": "server-attested",
      "blocking_count": 0,
      "cli_version": "2.1.237",
      "effort": "medium",
      "envelope_input_digest": "e60c37734ec21c4977dd564999a1d9936cbe7d6e1b55c1aaa7630c87785f577b",
      "findings": [
        {
          "blocking": false,
          "evidence": "The phase design pins the cutover as in-phase work (P3-8: \"Cutover (implementation-time, in Phase 3's own impl session): add approval_rules: {subjects: [prd, design, phase-design, phase-impl], ...} to .archflow/tasks/review-flexibility/config.yaml\"), lists that path under \"Files touched\", and states the success criterion \"The cutover edit lands in this task's config, is visible as a config_change notice, and keeps this task's phase-design gates opening from the very next session.\" The artifact contains no such edit: `outputs`/`restore_targets` do not include the task config, and `undeclared_changes.undeclared_paths` is only `.archflow/tasks/review-flexibility/state.json`. impl-notes \"Deviations\" bullet 1 confirms the deferral. With template/config defaults absent from this task's config, `evaluateApprovalRules` (src/state/approval-rules.ts:90-101) returns `{wait:false}` for every subject, and `advanceAction` (src/state/next-action.ts:207-214) therefore stops opening design-approval for this task's next phase-design — the exact self-application risk D9 and the task design's Risks section exist to prevent. The stated blocker (task config is a server-owned, non-claimable path class) prevents *declaring* the file as a phase output, not editing it: `state.json` shows an undeclared task-directory change riding the same commit.",
          "finding_id": "d9-cutover-absent-from-phase",
          "severity": "major",
          "suggested_resolution": "Make the cutover edit to `.archflow/tasks/review-flexibility/config.yaml` (full subject list plus the header refresh) before this phase's authorized commit, so the committed task config carries `approval_rules` and the next session's phase-design gate still opens; confirm the resulting `config_change` notice in the post-commit status and record the landing point in the implementation notes. If it genuinely cannot ride this commit, say so explicitly in the notes and name the exact session that lands it before any further phase settles.",
          "summary": "The pinned D9/P3-8 self-application cutover (adding approval_rules to this task's own config.yaml) is not in the change, so once this phase lands this task's remaining phases advance with no human gate."
        }
      ],
      "input_fingerprint": "dbb90487e38f52b4c6fe3f9107295f251c411e78f78b199482f911fa4baaeec4",
      "invocation_id": "invocation-c4079b6b4ea5e5c653c6615aaa48945a",
      "matched_rule_versions": [],
      "model": "claude-opus-5",
      "model_family": "claude",
      "observed_output_digest": "757c368909ac7baa4eda195d018ecc1ecf41cf242fff6b47ebed7242f505559d",
      "phase_instance": "phase-impl-3",
      "producer_family": "codex",
      "result_id": "result-142cf874e19846496079f0a3f9fbf99f",
      "role": "counter-review",
      "rubric_digest": "68405124576f2bdca2a95003bd13548aa352ea018926faa733fad95a99f39775",
      "schema_version": "1",
      "step": "counter_review",
      "subject_digest": "d5fccaee15996bd6d4f59815c42e56c12190365e86f6f11c263754f5b7893270",
      "task_id": "review-flexibility",
      "verdict": "advisory"
    },
    "schema_version": "1"
  },
  "step": "counter_review",
  "task_id": "review-flexibility"
}
