{
  "accounting": {
    "counted_entries": [],
    "measured_at_revision": 57,
    "result_byte_cap": 26214400,
    "result_bytes": 0,
    "schema_version": "1",
    "task_byte_cap": 262144000,
    "task_bytes": 6560549
  },
  "artifact_digest": "235ca8d2e61e72c18bcfe29ae871c2873ba2900763a309ef47d705ac034d3fac",
  "input_fingerprint": "469bdda474c3e3bb3096096592481d3cc8e5dc12dcfb7c052202ce1fbd8db465",
  "outputs": [],
  "phase_instance": "phase-impl-1",
  "projections": [],
  "repository_identity_digest": "5861ad3efec19d13e60f4b7476aea41151d4411b8b3fdd178038bc951a4778dc",
  "result_id": "result-df51d06d6af7336895310f5b67bc9eef",
  "schema_version": "1",
  "secret_scan": {
    "detector_set_id": "secretlint:v1:c823338405d647fa5308ef65538fca46af9c31ca460a699cd9d7e64a88db9896",
    "outcome": "clean",
    "scanned_paths": [],
    "schema_version": "1"
  },
  "snapshot_digest": "04fb2966b5c55579399c7a17c53947cc50c3500c36eedc3e5a4d402047ac1f67",
  "source_artifact": {
    "artifact_kind": "review-evidence",
    "evidence": {
      "adapter": "claude-cli",
      "assurance": "server-attested",
      "blocking_count": 0,
      "cli_version": "2.1.236",
      "effort": "medium",
      "envelope_input_digest": "fe06a7de362d51cecabb5896e4ad4100899ad4fe2f04f0b9cf4c71f468d10c0c",
      "findings": [],
      "input_fingerprint": "469bdda474c3e3bb3096096592481d3cc8e5dc12dcfb7c052202ce1fbd8db465",
      "invocation_id": "invocation-6a9bf8080a9636f003c3b91da45caf49",
      "matched_rule_versions": [],
      "model": "claude-opus-5",
      "model_family": "claude",
      "observed_output_digest": "dd009493fb762507e2bbee33bb8bdb251d187decda53dc2f980fab54eb09cb70",
      "phase_instance": "phase-impl-1",
      "producer_family": "claude",
      "result_id": "result-df51d06d6af7336895310f5b67bc9eef",
      "role": "counter-review",
      "rubric_digest": "68405124576f2bdca2a95003bd13548aa352ea018926faa733fad95a99f39775",
      "schema_version": "1",
      "step": "counter_review",
      "subject_digest": "60e329bfd8890aebb9db796d9a53aab54daeb81fc67201ca91e29f47b3d1a084",
      "task_id": "review-flexibility",
      "verdict": "pass"
    },
    "schema_version": "1"
  },
  "step": "counter_review",
  "task_id": "review-flexibility"
}
