{
  "accounting": {
    "counted_entries": [],
    "measured_at_revision": 11,
    "result_byte_cap": 26214400,
    "result_bytes": 0,
    "schema_version": "1",
    "task_byte_cap": 262144000,
    "task_bytes": 11748
  },
  "artifact_digest": "456b2e551a626453d1f4900a686324f42617f177d8047ded73788ce3bad6fa47",
  "input_fingerprint": "643a097810100c16012bc85027c2e61c80463452d323850fab7b65cb0b08dca3",
  "outputs": [],
  "phase_instance": "prd",
  "projections": [],
  "repository_identity_digest": "5861ad3efec19d13e60f4b7476aea41151d4411b8b3fdd178038bc951a4778dc",
  "result_id": "state-result-c85c42606a68587015fdd0ddb14426d9",
  "schema_version": "1",
  "secret_scan": {
    "detector_set_id": "secretlint:v1:c823338405d647fa5308ef65538fca46af9c31ca460a699cd9d7e64a88db9896",
    "outcome": "clean",
    "scanned_paths": [],
    "schema_version": "1"
  },
  "snapshot_digest": "04fb2966b5c55579399c7a17c53947cc50c3500c36eedc3e5a4d402047ac1f67",
  "source_artifact": {
    "artifact_kind": "triage",
    "evidence": {
      "accepted_count": 0,
      "accepted_editorial_count": 0,
      "current_evidence_set_digest": "25d7097fabdf5e6655207d654c99467a3c37475c2fba0ddd023f1089e5a123cf",
      "dispositions": [],
      "input_fingerprint": "643a097810100c16012bc85027c2e61c80463452d323850fab7b65cb0b08dca3",
      "phase_instance": "prd",
      "rejected_count": 0,
      "schema_version": "1",
      "source_evidence_digests": [
        "92b3c40fb5286af2d172cfbb12158e9e8f8b068ccadabfe9bd71ed1974fcc9bf"
      ],
      "step": "triage",
      "subject_digest": "058ec7fbf3d9a8ae54f48821ad23163c87209ca6389bbe010057637bde8aba99",
      "task_id": "review-flexibility"
    },
    "schema_version": "1"
  },
  "step": "triage",
  "task_id": "review-flexibility"
}
