{
  "accounting": {
    "counted_entries": [],
    "measured_at_revision": 170,
    "result_byte_cap": 26214400,
    "result_bytes": 0,
    "schema_version": "1",
    "task_byte_cap": 262144000,
    "task_bytes": 18419529
  },
  "artifact_digest": "2344d4769dbc89d15dba2c26a3ec636711de189777b671c50c8f43f61197733a",
  "input_fingerprint": "dbb90487e38f52b4c6fe3f9107295f251c411e78f78b199482f911fa4baaeec4",
  "outputs": [],
  "phase_instance": "phase-impl-3",
  "projections": [],
  "repository_identity_digest": "5861ad3efec19d13e60f4b7476aea41151d4411b8b3fdd178038bc951a4778dc",
  "result_id": "result-bae6151572527f21661100233e1c39da",
  "schema_version": "1",
  "secret_scan": {
    "detector_set_id": "secretlint:v1:c823338405d647fa5308ef65538fca46af9c31ca460a699cd9d7e64a88db9896",
    "outcome": "clean",
    "scanned_paths": [],
    "schema_version": "1"
  },
  "snapshot_digest": "04fb2966b5c55579399c7a17c53947cc50c3500c36eedc3e5a4d402047ac1f67",
  "source_artifact": {
    "artifact_kind": "review-evidence",
    "evidence": {
      "adapter": "claude-cli",
      "assurance": "server-attested",
      "blocking_count": 0,
      "cli_version": "2.1.234",
      "effort": "medium",
      "envelope_input_digest": "bfe97bdd53e3b1a0408d1d6774d277fb183a8cfcdc8d55460047affbd03785ca",
      "findings": [],
      "input_fingerprint": "dbb90487e38f52b4c6fe3f9107295f251c411e78f78b199482f911fa4baaeec4",
      "invocation_id": "invocation-f5b94afba5d1b9780bec59a3daff386a",
      "matched_rule_versions": [],
      "model": "claude-opus-5",
      "model_family": "claude",
      "observed_output_digest": "5749ca337575af7828bb655a819452962f45864e09a5b1a8bbf3fa0a4fea52dc",
      "phase_instance": "phase-impl-3",
      "producer_family": "claude",
      "result_id": "result-bae6151572527f21661100233e1c39da",
      "role": "counter-review",
      "rubric_digest": "68405124576f2bdca2a95003bd13548aa352ea018926faa733fad95a99f39775",
      "schema_version": "1",
      "step": "counter_review",
      "subject_digest": "96b8f2f1efd8b9e4e4fae0b935c357d46ce0ac345a411f35f632009b8b0b5ce5",
      "task_id": "api-refactor",
      "verdict": "pass"
    },
    "schema_version": "1"
  },
  "step": "counter_review",
  "task_id": "api-refactor"
}
