{
  "accounting": {
    "counted_entries": [],
    "measured_at_revision": 166,
    "result_byte_cap": 26214400,
    "result_bytes": 0,
    "schema_version": "1",
    "task_byte_cap": 262144000,
    "task_bytes": 22987450
  },
  "artifact_digest": "c600e0571ffeeb85d1c4190f7ee6d839064cf7c463a009c2b9fc97ca3b38005f",
  "input_fingerprint": "0675934403675cb96cbd2e7fe3e20acb1cac93eb0fc01aec3665a2fac94ffc3e",
  "outputs": [],
  "phase_instance": "phase-impl-3",
  "projections": [],
  "repository_identity_digest": "5861ad3efec19d13e60f4b7476aea41151d4411b8b3fdd178038bc951a4778dc",
  "result_id": "result-74369ecbafdf1a0dc95f78be260132ff",
  "schema_version": "1",
  "secret_scan": {
    "detector_set_id": "secretlint:v1:c823338405d647fa5308ef65538fca46af9c31ca460a699cd9d7e64a88db9896",
    "outcome": "clean",
    "scanned_paths": [],
    "schema_version": "1"
  },
  "snapshot_digest": "04fb2966b5c55579399c7a17c53947cc50c3500c36eedc3e5a4d402047ac1f67",
  "source_artifact": {
    "artifact_kind": "review-evidence",
    "evidence": {
      "adapter": "claude-cli",
      "assurance": "server-attested",
      "blocking_count": 0,
      "cli_version": "2.1.238",
      "effort": "medium",
      "envelope_input_digest": "69047e10f1cb239229c8141a9861de92c027d82a201932b06f12316b2e774148",
      "findings": [],
      "input_fingerprint": "0675934403675cb96cbd2e7fe3e20acb1cac93eb0fc01aec3665a2fac94ffc3e",
      "invocation_id": "invocation-51105504d1d9f78b9a31957863eb3b00",
      "matched_rule_versions": [],
      "model": "claude-opus-5",
      "model_family": "claude",
      "observed_output_digest": "4c18eb594b355dfbc53cf85df4a5c2eaa9e069fa987a9ca34e1943d7fc01c254",
      "phase_instance": "phase-impl-3",
      "producer_family": "codex",
      "result_id": "result-74369ecbafdf1a0dc95f78be260132ff",
      "role": "counter-review",
      "rubric_digest": "68405124576f2bdca2a95003bd13548aa352ea018926faa733fad95a99f39775",
      "schema_version": "1",
      "step": "counter_review",
      "subject_digest": "b51262111a3dae61879c855cfbbeb5d81599884a2accd7bbe23c9136a77cdb71",
      "task_id": "review-flexibility",
      "verdict": "pass"
    },
    "schema_version": "1"
  },
  "step": "counter_review",
  "task_id": "review-flexibility"
}
