{
  "accounting": {
    "counted_entries": [],
    "measured_at_revision": 9,
    "result_byte_cap": 26214400,
    "result_bytes": 0,
    "schema_version": "1",
    "task_byte_cap": 262144000,
    "task_bytes": 11748
  },
  "artifact_digest": "92b3c40fb5286af2d172cfbb12158e9e8f8b068ccadabfe9bd71ed1974fcc9bf",
  "input_fingerprint": "643a097810100c16012bc85027c2e61c80463452d323850fab7b65cb0b08dca3",
  "outputs": [],
  "phase_instance": "prd",
  "projections": [],
  "repository_identity_digest": "5861ad3efec19d13e60f4b7476aea41151d4411b8b3fdd178038bc951a4778dc",
  "result_id": "result-190f72ec953b4b832b772d73e67995cb",
  "schema_version": "1",
  "secret_scan": {
    "detector_set_id": "secretlint:v1:c823338405d647fa5308ef65538fca46af9c31ca460a699cd9d7e64a88db9896",
    "outcome": "clean",
    "scanned_paths": [],
    "schema_version": "1"
  },
  "snapshot_digest": "04fb2966b5c55579399c7a17c53947cc50c3500c36eedc3e5a4d402047ac1f67",
  "source_artifact": {
    "artifact_kind": "review-evidence",
    "evidence": {
      "adapter": "claude-cli",
      "assurance": "server-attested",
      "blocking_count": 0,
      "cli_version": "2.1.235",
      "effort": "medium",
      "envelope_input_digest": "fc6fd77f2db758cb225f79b199e82e00f346a34c659c3b4fbf3186661398dd20",
      "findings": [],
      "input_fingerprint": "643a097810100c16012bc85027c2e61c80463452d323850fab7b65cb0b08dca3",
      "invocation_id": "invocation-f36c6c6adde56adf9a717625d10beaa4",
      "matched_rule_versions": [],
      "model": "claude-opus-5",
      "model_family": "claude",
      "observed_output_digest": "a70efed3f0a8a640cde8afc2a9c04249f92f95bf6bd6d4662f9830ea78c3cf6e",
      "phase_instance": "prd",
      "producer_family": "claude",
      "result_id": "result-190f72ec953b4b832b772d73e67995cb",
      "role": "counter-review",
      "rubric_digest": "fad1d0bc48da5d04d33147d8bc18688d85d1ae18f782fac6a7f3e5c6f51d521f",
      "schema_version": "1",
      "step": "counter_review",
      "subject_digest": "058ec7fbf3d9a8ae54f48821ad23163c87209ca6389bbe010057637bde8aba99",
      "task_id": "review-flexibility",
      "verdict": "pass"
    },
    "schema_version": "1"
  },
  "step": "counter_review",
  "task_id": "review-flexibility"
}
