{
  "accounting": {
    "counted_entries": [],
    "measured_at_revision": 109,
    "result_byte_cap": 26214400,
    "result_bytes": 0,
    "schema_version": "1",
    "task_byte_cap": 262144000,
    "task_bytes": 6489744
  },
  "artifact_digest": "bc7ec18fc3daf813687487b6b3a1647732a1dc6a409dcaf5334ee6dd6683d6bb",
  "input_fingerprint": "603f0175f930a2b6f3eeed939550d10b450eb68c6608d94ab87fd2fe761a58b1",
  "outputs": [],
  "phase_instance": "phase-design-2",
  "projections": [],
  "repository_identity_digest": "5861ad3efec19d13e60f4b7476aea41151d4411b8b3fdd178038bc951a4778dc",
  "result_id": "result-1c1e8809d53dea6fccf661f80ab7031c",
  "schema_version": "1",
  "secret_scan": {
    "detector_set_id": "secretlint:v1:c823338405d647fa5308ef65538fca46af9c31ca460a699cd9d7e64a88db9896",
    "outcome": "clean",
    "scanned_paths": [],
    "schema_version": "1"
  },
  "snapshot_digest": "04fb2966b5c55579399c7a17c53947cc50c3500c36eedc3e5a4d402047ac1f67",
  "source_artifact": {
    "artifact_kind": "review-evidence",
    "evidence": {
      "adapter": "claude-cli",
      "assurance": "server-attested",
      "blocking_count": 0,
      "cli_version": "2.1.233",
      "effort": "medium",
      "envelope_input_digest": "8a8a267e10b017a60616d0a40644f0eb6fc3ca5dadc298831f21b3f54ba09f78",
      "findings": [],
      "input_fingerprint": "603f0175f930a2b6f3eeed939550d10b450eb68c6608d94ab87fd2fe761a58b1",
      "invocation_id": "invocation-16ed42b7350320e8b753ec75079407fd",
      "matched_rule_versions": [],
      "model": "claude-opus-5",
      "model_family": "claude",
      "observed_output_digest": "5687ba25ead19c5d71fb025d0f82f3d9768cfae8fcd24ea59287c8fbcd528e52",
      "phase_instance": "phase-design-2",
      "producer_family": "codex",
      "result_id": "result-1c1e8809d53dea6fccf661f80ab7031c",
      "role": "counter-review",
      "rubric_digest": "8023a567948bc5beb9caa889ddb1525c3309de7e2556a88d8182098e4afbbd25",
      "schema_version": "1",
      "step": "counter_review",
      "subject_digest": "26560cd0a5ba139c5fca1249085b70a4cc2324d2fb10f5772a997d3885da9545",
      "task_id": "api-refactor",
      "verdict": "pass"
    },
    "schema_version": "1"
  },
  "step": "counter_review",
  "task_id": "api-refactor"
}
