{
  "accounting": {
    "counted_entries": [],
    "measured_at_revision": 140,
    "result_byte_cap": 26214400,
    "result_bytes": 0,
    "schema_version": "1",
    "task_byte_cap": 262144000,
    "task_bytes": 12486089
  },
  "artifact_digest": "3f8dab7707a2bd77682ed6dd85bd71d71ee51e3884599fb0bd8759819a6ea4a2",
  "input_fingerprint": "88d3e6b96f68ae37fed1ee5d59a602ce78c0eb7b0939b00ed9a0151cf72c4dfb",
  "outputs": [],
  "phase_instance": "phase-impl-2",
  "projections": [],
  "repository_identity_digest": "5861ad3efec19d13e60f4b7476aea41151d4411b8b3fdd178038bc951a4778dc",
  "result_id": "state-result-03a18aa647e1fc7f8fb81f18ce5284d7",
  "schema_version": "1",
  "secret_scan": {
    "detector_set_id": "secretlint:v1:c823338405d647fa5308ef65538fca46af9c31ca460a699cd9d7e64a88db9896",
    "outcome": "clean",
    "scanned_paths": [],
    "schema_version": "1"
  },
  "snapshot_digest": "04fb2966b5c55579399c7a17c53947cc50c3500c36eedc3e5a4d402047ac1f67",
  "source_artifact": {
    "artifact_kind": "triage",
    "evidence": {
      "accepted_count": 0,
      "accepted_editorial_count": 0,
      "current_evidence_set_digest": "4849b7b71dfb599308401b0ea25c3b1a46f8d81f96e5f0e955b72ffc3f15a17c",
      "dispositions": [],
      "input_fingerprint": "88d3e6b96f68ae37fed1ee5d59a602ce78c0eb7b0939b00ed9a0151cf72c4dfb",
      "phase_instance": "phase-impl-2",
      "rejected_count": 0,
      "schema_version": "1",
      "source_evidence_digests": [
        "b431b25f36974008dbd0db86d8bb23939ce219ce9641111f47bf701970e99a5c"
      ],
      "step": "triage",
      "subject_digest": "350053e9f8cb3b436ee61d00b7d693947929218c6ba824a8288c80c2177c7c3f",
      "task_id": "api-refactor"
    },
    "schema_version": "1"
  },
  "step": "triage",
  "task_id": "api-refactor"
}
